### ISSUE TITLE
Roundcube 1.3.0 problems

### ISSUE THREAD

**Issue by teoberi** [roundcube/roundcubemail#5932]
My configuration:
Slackware64-current
postfix-3.2.2
dovecot-2.2.32
amavisd-new-2.11.0
httpd-2.4.27-x86_64
php-7.1.8
I can connect to Dovecot and Postfix from command line.
In config.inc.php I have:
IMAP
$config['default_host'] = 'localhost';
$config['imap_auth_type'] = 'PLAIN';
In step 3 "Test config" I have two problems:
Test filetype detection
Mimetype to file extension mapping:  NOT OK
Test IMAP config
Connecting to localhost...
IMAP connect:  NOT OK(Login failed for <username> from <IP address>. Wrong startup greeting (localhost:143): * OK [CAPABILITY IMAP4rev1 LITERAL+ SASL-IR LOGIN-REFERRALS ID ENABLE IDLE STARTTLS AUTH=PLAIN] Dovecot ready.)
In /var/log/maillog I have:
 ... dovecot: imap-login: Disconnected (no auth attempts in 0 secs): user=<>, rip=127.0.0.1, lip=127.0.0.1, secured, ...

**Comment by alecpl** [comment]
This is strange, because "* OK ..." is the expected greeting string. Maybe it sends some unexpected white space characters or the preg_match() check fails for any other reason. Maybe PHP bug.

https://github.com/roundcube/roundcubemail/blob/master/program/lib/Roundcube/rcube_imap_generic.php#L1001

Could you enable imap_debug in Roundcube config and provide (unmodified in any way) logs/imap file?

**Comment by teoberi** [comment]
Sep  1 16:16:28 mail roundcube: <umeic3md> [9BAD] S: * OK [CAPABILITY IMAP4rev1 LITERAL+ SASL-IR LOGIN-REFERRALS ID ENABLE IDLE STARTTLS AUTH=PLAIN] Dovecot ready.
Sep  1 16:16:28 mail dovecot: imap-login: Disconnected (no auth attempts in 0 secs): user=<>, rip=127.0.0.1, lip=127.0.0.1, secured, session=<08KbkSBYbNN/AAAB>

**Comment by alecpl** [comment]
I don't see strange chars here. Maybe you have to check with tcpdump or sth.

**Comment by teoberi** [comment]
I have another old server with Slackware 14.2 x86 with the same package (postfix-3.2.2, dovecot-2.2.32, amavisd-new-2.11.0, httpd-2.4.27, php-7.1.8 and Roundcube 1.3.0) and identical configuration.
 In this case it work and log are different!
Do you need that log?

**Comment by alecpl** [comment]
The problem is with the greeting line. So, I'm not sure what a proper log would help.

**Comment by teoberi** [comment]
What to check with tcpdump?
What is sth?

**Comment by teoberi** [comment]
Maybe it's a problem of authentication?

**Comment by alecpl** [comment]
No. The first line of server response is compared with a pattern. It is expected it to start with a `* OK`. This comparison fails for unknown reason. What's more, I see now the line is trimmed, so there should be no non-printable characters that would cause issue. This is strange.

**Comment by teoberi** [comment]
What about "Mimetype to file extension mapping:  NOT OK"
I copied mime.types to Roundcube folder and set $config['mime_types'] but without success.
Old server with Slackware 14.2 x86 does not have this problem.

**Comment by alecpl** [comment]
Usually this works with mime_types=null. Anyway that may fail on some of the test files and may not be a real issue.

**Comment by teoberi** [comment]
I installed Squirrelmail 1.4.23-svn on the same server and I can connect to IMAP (Dovecot) server with the same settings "localhost", port 143 and authentication type  plain.
I can send and receive mail but I have another issue with Squirrelmail.

**Comment by teoberi** [comment]
From tcpdump:
17:53:40.688229 IP localhost.54146 > localhost.imap: Flags [S], seq 2028279609, win 43690, options [mss 65495], length 0
17:53:40.688264 IP localhost.imap > localhost.54146: Flags [S.], seq 3204941172, ack 2028279610, win 43690, options [mss 65495], length 0
17:53:40.688288 IP localhost.54146 > localhost.imap: Flags [.], ack 1, win 43690, length 0
17:53:40.696059 IP localhost.imap > localhost.54146: Flags [P.], seq 1:113, ack 1, win 43690, length 112
17:53:40.696086 IP localhost.54146 > localhost.imap: Flags [.], ack 113, win 43690, length 0
17:53:40.696637 IP localhost.54146 > localhost.imap: Flags [F.], seq 1, ack 113, win 43690, length 0
17:53:40.698784 IP localhost.imap > localhost.54146: Flags [F.], seq 113, ack 2, win 43690, length 0
17:53:40.698816 IP localhost.54146 > localhost.imap: Flags [.], ack 114, win 43690, length 0

**Comment by alecpl** [comment]
> 17:53:40.696059 IP localhost.imap > localhost.54146: Flags [P.], seq 1:113, ack 1, win 43690, length 112

The packet length matches the greeting string length + 2 characters for \r\n. So, looks correct. This is really strange. Do you have preg_match function disabled in PHP config? It should log another error, but I'm out of ideas.

**Comment by teoberi** [comment]
No, is not disabled. I did a few tests for preg_match function with example from:
http://php.net/manual/en/function.preg-match.php
Example 1 & 2 OK
Example 3 failed, result is  -> domain name is:
Apache error_log:
[Mon Sep 04 12:07:20.728084 2017] [php7:notice] [pid 23162] [client 217.156.11.14:57911] PHP Notice:  Undefined offset: 1 in /var/www/htdocs/1.php on line 5
[Mon Sep 04 12:07:20.728220 2017] [php7:notice] [pid 23162] [client 217.156.11.14:57911] PHP Notice:  Undefined offset: 0 in /var/www/htdocs/1.php on line 9
Example 4 failed, result is ->  Array ( )
Maybe a PHP bug but I don't understand how is work for the other server with the same version of PHP.

**Comment by teoberi** [comment]
Maybe it would make sense to try with with PHP 7.0.23 or 5.6.31?

**Comment by teoberi** [comment]
I did all the 4 tests on the other server and they're OK all!

**Comment by alecpl** [comment]
Example #3 works for me on PHP 5.4 and 7.2. Compare php config on both servers. Maybe pcre.jit setting related issue.

**Comment by teoberi** [comment]
I found the same thing!
https://bugs.php.net/bug.php?id=70110
On both servers in php.ini  I have -> ; pcre.jit = 1
If I set pcre.jit = 0, both problems are resolved!!!
Thank you very much!

**Comment by jabiertxof** [comment]
Hi I have the same problem, but in PHP5.6. Here there is no option to set pcre.jit = 0
Any ideas?
